error_code,error_no,error_type,form_name,packet,var_name,check_type,test_name,short_desc,full_desc,test_logic,comp_forms,comp_vars,do_in_redcap,in_prev_versions,questions
b1l-lbdivp-p-1001,1001,Error,b1l,IL,FRMDATEB1L,Plausibility,FRMDATEB1L earliest date allowed,FRMDATEB1L must not be from date before form was released,Q0a. FRMDATEB1L (B1L form date) must not be from date before form was released (2017),IF FRMDATEB1L before (01/01/2017),,,,,
b1l-lbdivp-p-1002,1002,Alert,b1l,IL,LBSAGERM,Plausibility,LBSAGERM compared to LBCAREM on D1L,"If LBSAGERM is not in (888, 999) then Form D1L LBCAREM should not equal 0","If Q28. LBSAGERM (Age of onset of probable REM sleep behavior disorder) is not in (888, 999) (Not applicable or Unknown), then Form D1L Q4a. LBCAREM (REM sleep behavior disorder) should not equal 0 (Absent)","If LBSAGERM is in (888,999) and LBCAREM=0","b1l, d1l","LBSAGERM, LBCAREM",,,
b1l-lbdivp-p-1003,1003,Alert,b1l,IL,LBSAGERM,Plausibility,LBSAGERM compared to LBCAREM on D1L,If LBSAGERM =888 then Form D1L LBCAREM should not equal 1 or 2,If Q28. LBSAGERM (Age of onset of probable REM sleep behavior disorder) is not applicable (888) then Form D1L Q4a. LBCAREM (REM sleep behavior disorder) should not equal 1 or 2 (Questionably or definitely present),"If LBSAGERM =888 and LBCAREM in (1,2)","b1l, d1l","LBSAGERM, LBCAREM",,,
b1l-lbdivp-p-1004,1004,Alert,b1l,IL,LBSAGEFL,Plausibility,LBSAGEFL compared to LBCAFALL on D1L,"If LBSAGEFL is not in (888, 999) then Form D1L LBCAFALL should not equal 0","If Q31. LBSAGEFL (Age of onset of falls) is not in (888, 999) (Not applicable or Unknown), then Form D1L Q4j. LBCAFALL (Falls) should not equal 0 (Absent)","If LBSAGEFL is in (888,999) and LBCAFALL=0","b1l, d1l","LBSAGEF, LBCAFALL",,,
b1l-lbdivp-p-1005,1005,Alert,b1l,IL,LBSAGEFL,Plausibility,LBSAGEFL compared to LBCAFALL on D1L,If LBSAGEFL =888 then Form D1L LBCAFALL should not equal 1 or 2,If Q31. LBSAGEFL (Age of onset of falls) is not applicable (888) then Form D1L Q4j. LBCAFALL (Falls) should not equal 1 or 2 (Questionably or definitely present),"If LBSAGEFL =888 and LBCAFALL in (1,2)","b1l, d1l","LBSAGEF, LBCAFALL",,,
b1l-lbdivp-p-1006,1006,Alert,b1l,IL,LBSAGETR,Plausibility,LBSAGETR compared to LBCMRTRM and LBCMATRM on D1L,"If LBSAGETR is not in (888, 999) then one of Form D1L LBCMRTRM or LBCMATRM should not equal 0","If Q32. LBSAGETR (Age of onset of tremor) is not in (888, 999) (Not applicable or Unknown), then one of Form D1L Q2c. LBCMRTRM (Rest tremor) or Q2e. LBCMATRM (Action tremor) should not equal 0","If LBSAGETR is in (888,999) and LBCMRTRM=0 and LBCMATRM=0","b1l, d1l","LBSAGETR, LBCMRTRM, LBCMATRM",,,
b1l-lbdivp-p-1007,1007,Alert,b1l,IL,LBSAGETR,Plausibility,LBSAGETR compared to LBCMRTRM and LBCMATRM on D1L,If LBSAGETR =888 then both Form D1L LBCMRTRM and LBCMATRM should not equal 1 or 2,If Q32. LBSAGETR (Age of onset of tremor) is not applicable (888) then both Form D1L Q2c. LBCMRTRM (Rest tremor) and Q2e. LBCMATRM (Action tremor) should not equal 1 or 2,"If LBSAGETR =888 and LBCMRTRM in (1,2) and LBCMATRM in (1,2)","b1l, d1l","LBSAGETR, LBCMRTRM, LBCMATRM",,,
b1l-lbdivp-p-1008,1008,Alert,b1l,IL,LBSAGEBR,Plausibility,LBSAGEBR compared to LBCMBRAD on D1L,"If LBSAGEBR is not in (888, 999) then Form D1L LBCMBRAD should not equal 0","If Q33. LBSAGEBR (Age of onset of bradykinesia) is not in (888, 999) (Not applicable or Unknown), then Form D1L Q2a. LBCMBRAD (Bradykinesia) should not equal 0 (Absent)","If LBSAGEBR is in (888,999) and LBCMBRAD=0","b1l, d1l","LBSAGEBR, LBCMBRAD",,,
b1l-lbdivp-p-1009,1009,Alert,b1l,IL,LBSAGEBR,Plausibility,LBSAGEBR compared to LBCMBRAD on D1L,If LBSAGEBR =888 then Form D1L LBCMBRAD should not equal 1 or 2,If Q33. LBSAGEBR (Age of onset of bradykinesia) is not applicable (888) then Form D1L Q2a. LBCMBRAD (Bradykinesia)  should not equal 1 or 2 (Questionably or definitely present),"If LBSAGEBR =888 and LBCMBRAD in (1,2)","b1l, d1l","LBSAGEBR, LBCMBRAD",,,
b1l-lbdivp-p-1010,1010,Alert,b1l,IL,LBSAGERM,Plausibility,LBSAGERM compared to BEREMAGO on UDS Form B9 at the same visit,"If LBSAGERM is not in (888, 999) and UDS Form B9 BEREMAGO is non-missing (9-110), then LBSAGERM should equal BEREMAGO or 777","If Q28. LBSAGERM (Age of onset of probable REM sleep behavior disorder) is not in (888, 999) (Not applicable or Unknown) and UDS Form B9 Q12t1. BEREMAGO (Age that REM sleep behavior disorder began) is not in (888, 999) (Not applicable or Unknown), then Q28. LBSAGERM (Age of onset of probable REM sleep behavior disorder) should equal UDS Form B9 Q12t1. BEREMAGO (Age that REM sleep behavior disorder began)","If (LBSAGERM is in (888,999) and BEREMAGO is  in (888,999)) and LBSAGERM ne BEREMAGO","b1l, b9","LBSAGERM, BEREMAGO",,,
b1l-lbdivp-p-1011,1011,Alert,b1l,IL,LBSAGEGT,Plausibility,LBSAGEGT compared to GAIT on UDS Form B3 and MOGAIT on UDS Form B9 at the same visit,"If LBSAGEGT is not in (888, 999) then UDS Form B3 GAIT and UDS Form B9 MOGAIT should not equal 0 ","If Q30. LBSAGEGT (Age of onset of gait disorder) is not in (888, 999) (Not applicable or Unknown), then UDS Form B3 12. GAIT (Gait) and UDS Form B9 Q15a. MOGAIT (Gait problems) should not equal 0 (Gait disorder absent)","If LBSAGEGT is in (888,999) and GAIT=0 or MOGAIT=0 ","b1l, b9, b3","LBSAGEGT, GAIT, MOGAIT",,,
b1l-lbdivp-p-1012,1012,Alert,b1l,IL,LBSAGEFL,Plausibility,LBSAGEFL compared to MOFALLS on UDS Form B9 at the same visit,"If LBSAGEFL is not in (888, 999) then UDS Form B9 MOFALLS should not be equal to 0","If Q31. LBSAGEFL (Age of onset of falls) is not in (888, 999) (Not applicable or Unknown), then UDS Form B9 Q15b. MOFALLS (Falls) should not be equal to 0","If LBSAGEFL is in (888,999) and MOFALLS=0","b1l, b9","LBSAGEFL, MOFALLS",,,
