error_code,error_no,error_type,form_name,packet,var_name,check_type,test_name,short_desc,full_desc,test_logic,comp_forms,comp_vars,do_in_redcap,in_prev_versions,questions
c6f-ftldivp-m-001,001,Error,c6f,IF,FRMDATEC6F,Missingness,FRMDATEC6F must be present,FRMDATEC6F cannot be blank,Q0a. FRMDATEC6F (C6F form date) cannot be blank ,If FRMDATEC6F = blank,,,Yes,No,
c6f-ftldivp-c-002,002,Error,c6f,IF,FRMDATEC6F,Conformity,FRMDATEC6F conforms,FRMDATEC6F must be a date,Q0a. FRMDATEC6F (C6F form date) must be a date formatted mm/dd/yyyy or yyyy/mm/dd,If FRMDATEC6F is not mm/dd/yyyy or yyyy/mm/dd,,,Yes,No,
c6f-ftldivp-m-003,003,Error,c6f,IF,LANGC6F,Missingness,LANGC6F must be present,LANGC6F cannot be blank,Q0c. LANGC6F (Language of C6F administration) cannot be blank,If LANGC6F = blank,,,Yes,Yes,
c6f-ftldivp-c-004,004,Error,c6f,IF,LANGC6F,Conformity,LANGC6F conforms,LANGC6F must be an integer between 1-2,Q0c. LANGC6F (Language of C6F administration) must be an integer between 1-2,If LANGC6F < 1 or LANGC6F > 2,,,Yes,Yes,
c6f-ftldivp-m-005,005,Error,c6f,IF,MODEC6F,Missingness,MODEC6F must be present,MODEC6F cannot be blank,Q0d. MODEC6F (C6F in-person or not completed?) cannot be blank,If MODEC6F = blank,,,Yes,No,
c6f-ftldivp-c-006,006,Error,c6f,IF,MODEC6F,Conformity,MODEC6F conforms,MODEC6F must be an integer between 0-1,Q0d. MODEC6F (C6F in-person or not completed?) must be an integer between 0-1,If MODEC6F < 0 or MODEC6F > 1,,,Yes,No,
c6f-ftldivp-m-007,007,Error,c6f,IF,C6FNOT,Missingness,C6FNOT conditionally blank,IF MODEC6F = 1 then C6FNOT must be blank,"If Q0d. MODEC6F (C6F in-person or not completed?) = 1 (In-person) then Q0d1. C6FNOT (If form was not completed, specify reason) must be blank",If MODEC6F=1 and C6FNOT is not blank,,"MODEC6F, C6FNOT",Yes,No,
c6f-ftldivp-m-008,008,Error,c6f,IF,C6FNOT,Missingness,C6FNOT conditionally present,If MODEC6F = 0 then C6FNOT cannot be blank,"If Q0d. MODEC6F (C6F in-person or not completed?) = 0 (Not completed) then Q0d1. C6FNOT (If form was not completed, specify reason) cannot be blank",If MODEC6F = 0 and C6FNOT = blank,,"MODEC6F, C6FNOT",Yes,No,
c6f-ftldivp-c-009,009,Error,c6f,IF,C6FNOT,Conformity,C6FNOT conforms,C6FNOT must be an integer between 95-99,"Q0d1. C6FNOT (If form was not completed, specify reason) must be an integer between 95-99",If C6FNOT < 95 or C6FNOT >99,,,Yes,No,
c6f-ftldivp-m-010,010,Error,c6f,IF,MODEC6F,Missingness,C6F form must be blank,"If MODEC6F = 0, form should not have data filled","If Q0d. MODEC6F (C6F in-person or not completed?) = 0 (Not completed), form C6F should not have data filled",IF MODEC6F=0 and rest of form is not blank,,,No,No,
c6f-ftldivp-m-011,011,Error,c6f,IF,FTDCPC6F,Missingness,FTDCPC6F must be present,FTDCPC6F cannot be blank,Q0. FTDCPC6F (how was this form completed) cannot be blank,FTDCPC6F=blank,,,,,
c6f-ftldivp-c-012,012,Error,c6f,IF,FTDCPC6F,Conformity,FTDCPC6F conforms,"FTDCPC6F must be 0, 1, or 2","Q0. FTDCPC6F (how was this form completed) must be 0, 1, or 2","FTDCPC6F=0,1,2",,,,,
c6f-ftldivp-c-013,013,Error,c6f,IF,FTDALTER,Conformity,FTDALTER conforms,FTDALTER must be between 0 and 5,Q1. FTDALTER (alter behavior) must be between 0 and 5,FTDALTER<0 or FTDALTER>5,,,,,
c6f-ftldivp-c-014,014,Error,c6f,IF,FTDEMOT,Conformity,FTDEMOT conforms,FTDEMOT must be between 0 and 5,Q2. FTDEMOT (true emotions) must be between 0 and 5,FTDEMOT<0 or FTDEMOT>5,,,,,
c6f-ftldivp-c-015,015,Error,c6f,IF,FTDACROS,Conformity,FTDACROS conforms,FTDACROS must be between 0 and 5,Q3. FTDACROS (come across) must be between 0 and 5,FTDACROS<0 or FTDACROS>5,,,,,
c6f-ftldivp-c-016,016,Error,c6f,IF,FTDCONV,Conformity,FTDCONV conforms,FTDCONV must be between 0 and 5,Q4. FTDCONV (change in expression) must be between 0 and 5,FTDCONV<0 or FTDCONV>5,,,,,
c6f-ftldivp-c-017,017,Error,c6f,IF,FTDINTUI,Conformity,FTDINTUI conforms,FTDINTUI must be between 0 and 5,Q5. FTDINTUI (power of intuition) must be between 0 and 5,FTDINTUI<0 or FTDINTUI>5,,,,,
c6f-ftldivp-c-018,018,Error,c6f,IF,FTDJOKE,Conformity,FTDJOKE conforms,FTDJOKE must be between 0 and 5,Q6. FTDJOKE (joke in bad taste) must be between 0 and 5,FTDJOKE<0 or FTDJOKE>5,,,,,
c6f-ftldivp-c-019,019,Error,c6f,IF,FTDIMAGP,Conformity,FTDIMAGP conforms,FTDIMAGP must be between 0 and 5,Q7. FTDIMAGP (change image) must be between 0 and 5,FTDIMAGP<0 or FTDIMAGP>5,,,,,
c6f-ftldivp-c-020,020,Error,c6f,IF,FTDINAPP,Conformity,FTDINAPP conforms,FTDINAPP must be between 0 and 5,Q8. FTDINAPP (tell when inappropriate) must be between 0 and 5,FTDINAPP<0 or FTDINAPP>5,,,,,
c6f-ftldivp-c-021,021,Error,c6f,IF,FTDCHBEH,Conformity,FTDCHBEH conforms,FTDCHBEH must be between 0 and 5,Q9. FTDCHBEH (trouble changing behavior) must be between 0 and 5,FTDCHBEH<0 or FTDCHBEH>5,,,,,
c6f-ftldivp-c-022,022,Error,c6f,IF,FTDADBEH,Conformity,FTDADBEH conforms,FTDADBEH must be between 0 and 5,Q10. FTDADBEH (change to meet requirement) must be between 0 and 5,FTDADBEH<0 or FTDADBEH>5,,,,,
c6f-ftldivp-c-023,023,Error,c6f,IF,FTDLYING,Conformity,FTDLYING conforms,FTDLYING must be between 0 and 5,Q11. FTDLYING (know when lying) must be between 0 and 5,FTDLYING<0 or FTDLYING>5,,,,,
c6f-ftldivp-c-024,024,Error,c6f,IF,FTDGOODF,Conformity,FTDGOODF conforms,FTDGOODF must be between 0 and 5,Q12. FTDGOODF (good front) must be between 0 and 5,FTDGOODF<0 or FTDGOODF>5,,,,,
c6f-ftldivp-c-025,025,Error,c6f,IF,FTDREGUL,Conformity,FTDREGUL conforms,FTDREGUL must be between 0 and 5,Q13. FTDREGUL (regulate actions) must be between 0 and 5,FTDREGUL<0 or FTDREGUL>5,,,,,
c6f-ftldivp-m-026,026,Error,c6f,IF,FTDSMSCR,Missingness,FTDSMSCR must be present,FTDSMSCR cannot be blank,Q14. FTDSMSCR (expressiveness score) cannot be blank,FTDSMSCR=blank,,,,,
c6f-ftldivp-c-027,027,Error,c6f,IF,FTDSMSCR,Conformity,FTDSMSCR conforms,FTDSMSCR must be between 0 and 30 or 88,Q14. FTDSMSCR (expressiveness score) must be between 0 and 30 or 88,FTDSMSCR<0 or (FTDSMSCR>30 and FTDSMSCR ne 88),,,,,
c6f-ftldivp-m-028,028,Error,c6f,IF,FTDSPSCR,Missingness,FTDSPSCR must be present,FTDSPSCR cannot be blank,Q15. FTDSPSCR (self-presentation score) cannot be blank,FTDSPSCR=blank,,,,,
c6f-ftldivp-c-029,029,Error,c6f,IF,FTDSPSCR,Conformity,FTDSPSCR conforms,FTDSPSCR must be between 0 and 35 or 88,Q15. FTDSPSCR (self-presentation score) must be between 0 and 35 of 88,FTDSPSCR<0 or (FTDSPSCR>35 and FTDSPSCR ne 88),,,,,
c6f-ftldivp-m-030,030,Error,c6f,IF,FTDRSMST,Missingness,FTDRSMST must be present,FTDRSMST cannot be blank,Q16. FTDRSMST (RSMS total score) cannot be blank,FTDRSMST=blank,,,,,
c6f-ftldivp-c-031,031,Error,c6f,IF,FTDRSMST,Conformity,FTDRSMST conforms,FTDRSMST must be between 0 and 65 or 88,Q16. FTDRSMST (RSMS total score) must be between 0 and 65 or 88,FTDRSMST<0 and (FTDRSMST>65 and FTDRSMST ne 88),,,,,
