error_code,error_no,error_type,form_name,packet,var_name,check_type,test_name,short_desc,full_desc,test_logic,comp_forms,comp_vars,do_in_redcap,in_prev_versions,questions
d1a-ivp-m-253,253,Error,d1a,I,COGOTH3,Missingness,COGOTH3 conditionally blank,If NORMCOG=1 then COGOTH3 must be blank or 0,If (Q2. NORMCOG (Unimpaired cognition & behavior?)=1 (Yes)) then Q32. COGOTH3 (Cognitive impairment not otherwise specified (NOS) (present)) must be blank or 0,If NORMCOG=1 and (COGOTH3 is not blank or  ne 0),,"NORMCOG, COGOTH3  ",,,
d1a-ivp-c-254,254,Error,d1a,I,COGOTH3,Conformity,COGOTH3 conforms,"COGOTH3 must be blank, 0 or 1","Q32. COGOTH3 (Cognitive impairment not otherwise specified (NOS) (present)) must be blank, 0 or 1","If COGOTH3 is not blank or COGOTH3 is not in (0,1)",,,,,
d1a-ivp-m-255,255,Error,d1a,I,COGOTH3F,Missingness,COGOTH3F conditionally blank,If COGOTH3 ne 1 then COGOTH3F must be blank,If Q32. COGOTH3 (Cognitive impairment not otherwise specified (NOS) (present)) ne 1 (absent) then Q32a. COGOTH3F (Cognitive impairment NOS (primary/contributing/non-contributing)) must be blank,If COGOTH3 ne 1 and COGOTH3F is not blank,,"COGOTH3, COGOTH3F  ",,,
d1a-ivp-m-256,256,Error,d1a,I,COGOTH3F,Missingness,COGOTH3F conditionally present,If COGOTH3=1 then COGOTH3F cannot be blank,If Q32. COGOTH3 (Cognitive impairment not otherwise specified (NOS) (present))=1 (present) then Q32a. COGOTH3F (Cognitive impairment NOS (primary/contributing/non-contributing)) cannot be blank,If COGOTH3=1 and COGOTH3F is blank,,"COGOTH3, COGOTH3F  ",,,
d1a-ivp-c-257,257,Error,d1a,I,COGOTH3F,Conformity,COGOTH3F conforms,COGOTH3F must be an integer between 1-3,Q32a. COGOTH3F (Cognitive impairment NOS (primary/contributing/non-contributing)) must be an integer between 1-3,If COGOTH3F <1 or COGOTH3F >3,,,,,
d1a-ivp-m-258,258,Error,d1a,I,COGOTH3X,Missingness,COGOTH3X conditionally blank,If COGOTH3 ne 1 then COGOTH3X must be blank,If Q32. COGOTH3 (Cognitive impairment not otherwise specified (NOS) (present)) ne 1 (absent) then Q32b. COGOTH3X (Cognitive impairment NOS (specify)) must be blank,If COGOTH3 ne 1 and COGOTH3X is not blank,,"COGOTH3, COGOTH3X  ",,,
d1a-ivp-m-259,259,Error,d1a,I,COGOTH3X,Missingness,COGOTH3X conditionally present,If COGOTH3=1 then COGOTH3X cannot be blank,If Q32. COGOTH3 (Cognitive impairment not otherwise specified (NOS) (present))=1 (present) then Q32b. COGOTH3X (Cognitive impairment NOS (specify)) cannot be blank,If COGOTH3=1 and COGOTH3X is blank,,"COGOTH3, COGOTH3X  ",,,
d1a-ivp-m-260,260,Error,d1a,I,MAJDEPDIF,Missingness,Only one primary cause of cognitive impairment  should be present,"Only one of the following variables should equal 1: MAJDEPDIF, OTHDEPDIF, BIPOLDIF, SCHIZOIF, ANXIETIF, PTSDDXIF, NDEVDISIF, DELIRIF, OTHPSYIF, TBIDXIF, EPILEPIF, HYCEPHIF, NEOPIF, HIVIF, POSTC19IF, APNEADXIF, OTHCILLIF, ALCDEMIF, IMPSUBIF, MEDSIF, COGOTHIF, COGOTH2F, COGOTH3F","Only one of the following variables should equal 1 (Primary): Q10a. MAJDEPDIF, Q11a. OTHDEPDIF, Q12a. BIPOLDIF, Q13a. SCHIZOIF, Q14a. ANXIETIF, Q15a. PTSDDXIF, Q16a. NDEVDISIF, Q17a. DELIRIF, Q18a. OTHPSYIF, Q19a. TBIDXIF, Q20a. EPILEPIF, Q21a. HYCEPHIF, Q22a. NEOPIF, Q23a. HIVIF, Q24a. POSTC19IF, Q25a. APNEADXIF, Q26a. OTHCILLIF, Q27a. ALCDEMIF, Q28a. IMPSUBIF, Q29a. MEDSIF, Q30a. COGOTHIF, Q31a. COGOTH2F, Q32a. COGOTH3F","If more than one of the following variables =1 (MAJDEPDIF, OTHDEPDIF, BIPOLDIF, SCHIZOIF, ANXIETIF, PTSDDXIF, NDEVDISIF, DELIRIF, OTHPSYIF, TBIDXIF, EPILEPIF, HYCEPHIF, NEOPIF, HIVIF, POSTC19IF, APNEADXIF, OTHCILLIF, ALCDEMIF, IMPSUBIF, MEDSIF, COGOTHIF, COGOTH2F, COGOTH3F)",,"MAJDEPDIF, OTHDEPDIF, BIPOLDIF, SCHIZOIF, ANXIETIF, PTSDDXIF, NDEVDISIF, DELIRIF, OTHPSYIF, TBIDXIF, EPILEPIF, HYCEPHIF, NEOPIF, HIVIF, POSTC19IF, APNEADXIF, OTHCILLIF, ALCDEMIF, IMPSUBIF, MEDSIF, COGOTHIF, COGOTH2F, COGOTH3F",,,
d1a-ivp-m-261,261,Error,d1a,I,PREDOMSYN,Missingness,At least one source of information used to assess the clinical syndrome must be checked,"If PREDOMSYN=1 then at least one of the following variables must be equal to 1: SYNINFCLIN, SYNINFCTST, SYNINFBIOM","If Q8. PREDOMSYN (Is there a predominant clinical syndrome?) then at least one of the following variables must be equal to 1:  Q9a. SYNINFCLIN, Q9b. SYNINFCTST, Q9c. SYNINFBIOM",If PREDOMSYN=1 and (SYNINFCLIN ne 1 and SYNINFCTST ne 1 and SYNINFBIOM ne 1),,"PREDOMSYN, SYNINFCLIN, SYNINFCTST, SYNINFBIOM",,,
