error_code,error_no,error_type,form_name,packet,var_name,check_type,test_name,short_desc,full_desc,test_logic,comp_forms,comp_vars,do_in_redcap,in_prev_versions,questions
a4a-fvp-m-229,229,Error,a4a,F,ARIAH,Missingness,ARIAH conditionally blank,"If ADVEVENT  in (0, 9) and NEWADEVENT in (0,9) then ARIAH must be blank","If Q3. ADVEVENT (adverse events) in (0, 9) and Q3a. NEWADEVENT (new adverse event) in (0,9) then Q3b2. ARIAH (hemorrhage abnormalities) must be blank","If ADVEVENT  in (0, 9) and NEWADEVENT in (0,9) and ARIAH is not blank",,"ADVEVENT, NEWADEVENT, ARIAH",Yes,,
a4a-fvp-c-230,230,Error,a4a,F,ARIAH,Conformity,ARIAH conforms,ARIAH must be 1 or blank,Q3b2. ARIAH (hemorrhage abnormalities) must be 1 or blank,If ARIAH ne 1 and ARIAH is not blank,,,Yes,,
a4a-fvp-m-231,231,Error,a4a,F,ADVERSEOTH,Missingness,ADVERSEOTH conditionally blank,"If ADVEVENT  in (0, 9) and NEWADEVENT in (0,9) then ADVERSEOTH must be blank","If Q3. ADVEVENT (adverse events) in (0, 9) and Q3a. NEWADEVENT (new adverse event) in (0,9) then Q3b3. ADVERSEOTH (other adverse event) must be blank","If ADVEVENT  in (0, 9) and NEWADEVENT in (0,9) and ADVERSEOTH is not blank",,"ADVEVENT, NEWADEVENT, ADVERSEOTH",Yes,,
a4a-fvp-c-232,232,Error,a4a,F,ADVERSEOTH,Conformity,ADVERSEOTH conforms,ADVERSEOTH must be 1 or blank,Q3b3. ADVERSEOTH (other adverse event) must be 1 or blank,If ADVERSEOTH ne 1 and ADVERSEOTH is not blank,,,Yes,,
a4a-fvp-m-233,233,Error,a4a,F,ARIAE,Missingness,"ARIAE, ARIAH, ADVERSEOTH conditionally present"," If NEWADVEVENT=1 then at least one of the following variables must be 1: ARIAE, ARIAH, ADVERSEOTH","If Q3a. NEWADEVENT (new adverse event)=1 then at least one of the following variables must be 1: Q3b1. ARIAE (edeme abnormalities), Q3b2. ARIAH (hemorrhage abnormalities), or Q3b3. ADVERSEOTH (other adverse event)",If NEWADVEVENT=1 and ARIAE=blank and ARIAH=blank and ADVERSEOTH=blank,,"NEWADVEVENT, ARIAE, ARIAH, ADVERSEOTH",No,,
a4a-fvp-m-234,234,Error,a4a,F,ADVERSEOTX,Missingness,ADVERSEOTX conditionally present,If ADVERSEOTH=1 then ADVERSEOTX cannot be blank,If Q3a3. ADVERSEOTH (other adverse event)=1 then Q3b3a. ADVERSEOTX (other adverse event specify) cannot be blank,If ADVERSEOTH=1 and ADVERSEOTX=blank,,"ADVERSEOTH, ADVERSEOTX",Yes,,
a4a-fvp-m-235,235,Error,a4a,F,ADVERSEOTX,Missingness,ADVERSEOTX conditionally blank,If ADVERSEOTH is blank then ADVERSEOTX must be blank,If Q3a3. ADVERSEOTH (other adverse event) is blank then Q3b3a. ADVERSEOTX (other adverse event specify) must be blank,If ADVERSEOTH=blank and ADVERSEOTX is not blank,,"ADVERSEOTH, ADVERSEOTX",Yes,,
