error_code,error_no,error_type,form_name,packet,var_name,check_type,test_name,short_desc,full_desc,test_logic,comp_forms,comp_vars,do_in_redcap,in_prev_versions,questions
b2l-lbdivp-p-1001,1001,Error,b2l,IL,FRMDATEB2L,Plausibility,FRMDATEB2L earliest date allowed,FRMDATEB2L must not be from date before form was released,Q0a. FRMDATEB2L (B2L form date) must not be from date before form was released (2017),IF FRMDATEB2L before (01/01/2017),,,,,
b2l-lbdivp-p-1002,1002,Alert,b2l,IL,LBUDFALL,Plausibility,LBUDFALL compared to Form D1L LBCAFALL,If LBUDFALL= 3 or 4 then Form D1L LBCAFALL should not equal 0,If Q9. LBUDFALL (Falling (unrelated to freezing)) = 3 or 4 (Falls an average of once daily or more than once daily) then Form D1L Q4j. LBCAFALL (Falls) should not equal 0 (Absent),"If LBUDFALL in (3,4) and LBCAFALL=0","b2l, d1l","LBUDFALL, LBCAFALL",,,
b2l-lbdivp-p-1003,1003,Alert,b2l,IL,LBUDFALL,Plausibility,LBUDFALL compared to Form D1L LBCAFALL,If LBUDFALL= 0 then Form D1L LBCAFALL should not equal 2,If Q9. LBUDFALL (Falling (unrelated to freezing)) = 0 (None) then Form D1L Q4j. LBCAFALL (Falls) should not equal 2 (Definitely present),"If LBUDFALL=0 and LBCAFALL in (1,2)","b2l, d1l","LBUDFALL, LBCAFALL",,,
b2l-lbdivp-p-1004,1004,Alert,b2l,IL,LBUDTREM,Plausibility,"LBUDTREM compared to Form D1L LBCMRTRM, LBCMPTRM, and LBCMATRM","If LBUDTREM= 3 or 4 then at least one of these Form D1L variables should equal 2: LBCMRTRM, LBCMPTRM, or LBCMATRM","If Q12. LBUDTREM (Tremor)= 3 or 4 (Severe or marked; interferes with most activities) then at least one of these Form D1L variables should equal 2: Q2c. LBCMRTRM (resting tremor), Q2d. LBCMPTRM (postural tremor), or Q2e. LBCMATRM (action tremor)","If LBUDTREM in (3,4) and (LBCMRTRM ne 2 and LBCMPTRM ne 2 and LBCMATRM ne 2)","b2l, d1l","LBUDTREM, LBCMRTRM, LBCMPTRM, LBCMATRM",,,
b2l-lbdivp-p-1005,1005,Alert,b2l,IL,LBUDTREM,Plausibility,"LBUDTREM compared to Form D1L LBCMRTRM, LBCMPTRM, and LBCMATRM","If LBUDTREM= 0 then all of these Form D1L variables should equal 0 or blank: LBCMRTRM, LBCMPTRM, or LBCMATRM","If Q12. LBUDTREM (Tremor)= 0 (Absent) then all of these Form D1L variables should equal 0 or blank: Q2c. LBCMRTRM (resting tremor), Q2d. LBCMPTRM (postural tremor), or Q2e. LBCMATRM (action tremor)",If LBUDTREM=0 and (LBCMRTRM ne (0 or blank) and LBCMPTRM ne (0 or blank) and LBCMATRM ne (0 or blank)),"b2l, d1l","LBUDTREM, LBCMRTRM, LBCMPTRM, LBCMATRM",,,
