error_code,error_no,error_type,form_name,packet,var_name,check_type,test_name,short_desc,full_desc,test_logic,comp_forms,comp_vars,do_in_redcap,in_prev_versions,questions
a2-ivp-p-1001,1001,Alert,a2,I,INLIVWTH,Plausibility,INLIVWTH compared to INRELTO,IF INRELTO=1 and INLIVWTH=0,"IF Q1. INRELTO (relationship to participant)=1 (spouse, partner, companion) and Q3. INLIVWTH (lives with participant?)=0 (no) ",IF INRELTO=1 and INLIVWTH=0,,"INRELTO, INLIVWTH",Yes,Yes,
a2-ivp-p-1002,1002,Alert,a2,I,INLIVWTH,Plausibility,INLIVWTH compared to participants living situation ,IF INLIVWTH=1 then LIVSITUA cannot equal 1,"IF Q3. INLIVWTH (lives with participant?)=1 (yes) then Form A1, Q12. LIVSITUA (participant's living situation) should not equal 1 (lives alone)",IF INLIVWTH=1 and LIVSITUA=1,"a1, a2","INLIVWTH, LIVSITUA",Yes,Yes,
a2-ivp-p-1009,1009,Alert,a2,I,INMEMWORS,Plausibility,INMEMWORS aligns with co-participant report on B9,"If INMEMWORS=1,2 then DECCOGIN should equal 1","Q6. INMEMWORS (participant's memory is worse?)=1,2 (Yes) then Form B9, Q4. DECCOGIN (Co-participant-reported cognitive decline) should equal 1 (Yes)","IF INMEMWORS=1,2 and DECCOGIN ne 1","a2, b9","INMEMWORS, DECCOGIN",No,No,
a2-ivp-p-1010,1010,Alert,a2,I,INMEMTROUB,Plausibility,INMEMTROUB aligns with co-participant report on B9,"If INMEMTROUB=4,5 then DECCOGIN should equal 1","Q7. INMEMTROUB (participant trouble remembering?)=4,5 (Often or very often) then Form B9, Q4. DECCOGIN (Co-participant-reported cognitive decline) should equal 1 (Yes)","IF INMEMTROUB=4,5 and DECCOGIN ne 1","a2, b9","INMEMTROUB, DECCOGIN",No,No,
a2-ivp-p-1011,1011,Alert,a2,I,INMEMTEN,Plausibility,INMEMTEN aligns with co-participant report on B9,"If INMEMTEN=4,5 then DECCOGIN should equal 1","Q8. INMEMTEN (participant's memory compared to 10 years ago?)=4,5 (A little worse or much worse) then Form B9, Q4. DECCOGIN (Co-participant-reported cognitive decline) should equal 1 (Yes)","IF INMEMTEN=4,5 and DECCOGIN ne 1","a2, b9","INMEMTEN, DECCOGIN",No,No,
