error_code,error_no,error_type,form_name,packet,var_name,check_type,test_name,short_desc,full_desc,test_logic,comp_forms,comp_vars,do_in_redcap,in_prev_versions,questions
b9l-lbdfvp-p-1001,1001,Error,b9l,FL,FRMDATEB9L,Plausibility,FRMDATEB9L earliest date allowed,FRMDATEB9L must not be from date before form was released,Q0a. FRMDATEB9L (B9L form date) must not be from date before form was released (2017),IF FRMDATEB9L before (01/01/2017),,,,,
b9l-lbdfvp-p-1002,1002,Error,b9l,FL,SCCOFRST,Plausibility,SCCOFRST compared to SCCOAGEN,If SCCOFRST = 1 then SCCOAGEN should not be 888,If Q13. SCCOFRST (first predominant symptom to appear during the participant's lifetime) = 1 (disturbed nighttime sleep) then Q14. SCCOAGEN (At what age did the disturbed nighttime sleep first appear?) should not be 888,If SCCOFRST = 1 and SCCOAGEN = 888,,"SCCOFRST, SCCOAGEN",,,
b9l-lbdfvp-p-1003,1003,Error,b9l,FL,SCCOFRST,Plausibility,SCCOFRST compared to SCCOAGEN,If SCCOFRST = 0 then SCCOAGEN should be 777,If Q13. SCCOFRST (first predominant symptom to appear during the participant's lifetime) = 0 (provided at previous visit) then Q14. SCCOAGEN (At what age did the disturbed nighttime sleep first appear?) should be 777 (provided at previous visit),If SCCOFRST = 0 and SCCOAGEN not = 777,,"SCCOFRST, SCCOAGEN",,,
b9l-lbdfvp-p-1004,1004,Error,b9l,FL,SCCOFRST,Plausibility,SCCOFRST compared to SCCOAGED,If SCCOFRST = 2 then SCCOAGED should not be 888,If Q13. SCCOFRST (first predominant symptom to appear during the participant's lifetime)= 2 (excessive daytime sleepiness) then Q15. SCCOAGED (At what age did the excessive daytime sleepiness first appear?) should not be 888,If SCCOFRST = 1 and SCCOAGED = 888,,"SCCOFRST, SCCOAGED",,,
b9l-lbdfvp-p-1005,1005,Error,b9l,FL,SCCOFRST,Plausibility,SCCOFRST compared to SCCOAGED,If SCCOFRST = 0 then SCCOAGED should be 777,If Q13. SCCOFRST (first predominant symptom to appear during the participant's lifetime) = 0 then Q15. SCCOAGED (At what age did the excessive daytime sleepiness first appear?) should be 777,If SCCOFRST = 0 and SCCOAGED not = 777,,"SCCOFRST, SCCOAGED",,,
b9l-lbdfvp-p-1006,1006,Alert,b9l,FL,SCCOAGEN,Plausibility,SCCOAGEN is consistent with previous visit,"If SCCOAGEN=777, SCCOAGEN[prev_vis] should be in (15 - 110 or 777)","If Q14. SCCOAGEN=777, Q14. SCCOAGEN from previous visit should be a valid value",If SCCOAGEN=777 and SCCOAGEN[prev_vis] not in (15 - 110, 777),"b9l, b9l[prev_vis]","SCCOAGEN[prev_vis], SCCOAGEN",,,
b9l-lbdfvp-p-1007,1007,Alert,b9l,FL,SCCOAGED,Plausibility,SCCOAGED is consistent with previous visit,"If SCCOAGED=777, SCCOAGED[prev_vis] should be in (15 - 110 or 777)","If Q15. SCCOAGED=777, Q15. SCCOAGED from previous visit should be a valid value",If SCCOAGED=777 and SCCOAGED[prev_vis] not in (15 - 110, 777),"b9l, b9l[prev_vis]","SCCOAGED[prev_vis], SCCOAGED",,,
